{
  "$schema": "https://json-schema.org/draft/2020-12/schema",
  "$id": "urn:tiling-foundry:schema:wang-solution-v1",
  "title": "Tiling Foundry square Wang solution v1",
  "description": "Structural contract for a SAT square Wang tiling. Cross-field tiling semantics are validated separately.",
  "type": "object",
  "additionalProperties": false,
  "required": [
    "schema",
    "status",
    "geometry",
    "bounds",
    "tile_table",
    "cells",
    "boundary",
    "metadata"
  ],
  "properties": {
    "schema": {
      "const": "wang-solution-v1"
    },
    "status": {
      "const": "SAT"
    },
    "geometry": {
      "const": "square"
    },
    "bounds": {
      "$ref": "#/$defs/inclusive_bounds"
    },
    "tile_table": {
      "type": "array",
      "minItems": 1,
      "items": {
        "$ref": "#/$defs/tile"
      }
    },
    "cells": {
      "type": "array",
      "minItems": 1,
      "items": {
        "oneOf": [
          {
            "type": "integer",
            "minimum": 0
          },
          {
            "type": "null"
          }
        ]
      }
    },
    "boundary": {
      "type": "array",
      "minItems": 1,
      "items": {
        "oneOf": [
          {
            "$ref": "#/$defs/optional_edges"
          },
          {
            "type": "null"
          }
        ]
      }
    },
    "metadata": {
      "description": "Non-semantic producer or display data. Correctness must not depend on this object.",
      "type": "object",
      "additionalProperties": true
    }
  },
  "$defs": {
    "color": {
      "type": "integer",
      "minimum": 0
    },
    "inclusive_bounds": {
      "type": "object",
      "additionalProperties": false,
      "required": [
        "min_x_inclusive",
        "min_y_inclusive",
        "max_x_inclusive",
        "max_y_inclusive"
      ],
      "properties": {
        "min_x_inclusive": {
          "type": "integer"
        },
        "min_y_inclusive": {
          "type": "integer"
        },
        "max_x_inclusive": {
          "type": "integer"
        },
        "max_y_inclusive": {
          "type": "integer"
        }
      }
    },
    "edges": {
      "type": "object",
      "additionalProperties": false,
      "required": [
        "N",
        "E",
        "S",
        "W"
      ],
      "properties": {
        "N": {
          "$ref": "#/$defs/color"
        },
        "E": {
          "$ref": "#/$defs/color"
        },
        "S": {
          "$ref": "#/$defs/color"
        },
        "W": {
          "$ref": "#/$defs/color"
        }
      }
    },
    "optional_color": {
      "oneOf": [
        {
          "$ref": "#/$defs/color"
        },
        {
          "type": "null"
        }
      ]
    },
    "optional_edges": {
      "type": "object",
      "additionalProperties": false,
      "required": [
        "N",
        "E",
        "S",
        "W"
      ],
      "properties": {
        "N": {
          "$ref": "#/$defs/optional_color"
        },
        "E": {
          "$ref": "#/$defs/optional_color"
        },
        "S": {
          "$ref": "#/$defs/optional_color"
        },
        "W": {
          "$ref": "#/$defs/optional_color"
        }
      }
    },
    "tile": {
      "type": "object",
      "additionalProperties": false,
      "required": [
        "tile_id",
        "edges"
      ],
      "properties": {
        "tile_id": {
          "type": "integer",
          "minimum": 0
        },
        "edges": {
          "$ref": "#/$defs/edges"
        }
      }
    }
  }
}
